{"$schema":"https://json-schema.org/draft/2020-12/schema","type":"object","required":["id","text","type","anchor","context","loading","options","tags"],"properties":{"id":{"type":"string","pattern":"^q[0-9]{3}$"},"text":{"type":"string","minLength":20},"type":{"enum":["likert","choice"]},"anchor":{"type":"boolean"},"context":{"type":"string"},"loading":{"type":"object","additionalProperties":{"type":"number","minimum":-1,"maximum":1}},"options":{"type":"array","minItems":3},"tags":{"type":"array","items":{"type":"string"}}},"additionalProperties":true}
