[
  {
    "id": "q001",
    "text": "Pour expliquer une crise économique, il faut d’abord reconstruire les décisions et contraintes des agents individuels plutôt que partir d’agrégats sociaux.",
    "type": "likert",
    "loading": {
      "method_individualism": 1.0
    },
    "anchor": true,
    "context": "general",
    "options": [
      "strongly_disagree",
      "disagree",
      "neutral",
      "agree",
      "strongly_agree",
      "unsure",
      "depends"
    ],
    "tags": [
      "anchor",
      "method_individualism"
    ]
  },
  {
    "id": "q002",
    "text": "Les classes, organisations et structures sociales peuvent avoir des effets économiques irréductibles à la somme des choix individuels.",
    "type": "likert",
    "loading": {
      "method_individualism": -1.0
    },
    "anchor": true,
    "context": "general",
    "options": [
      "strongly_disagree",
      "disagree",
      "neutral",
      "agree",
      "strongly_agree",
      "unsure",
      "depends"
    ],
    "tags": [
      "anchor",
      "method_individualism"
    ]
  },
  {
    "id": "q003",
    "text": "Une bonne explication économique doit préciser les mécanismes reliant les décisions individuelles au résultat collectif.",
    "type": "likert",
    "loading": {
      "method_individualism": 1.0
    },
    "anchor": false,
    "context": "general",
    "options": [
      "strongly_disagree",
      "disagree",
      "neutral",
      "agree",
      "strongly_agree",
      "unsure",
      "depends"
    ],
    "tags": [
      "adaptive",
      "method_individualism"
    ]
  },
  {
    "id": "q004",
    "text": "Il est légitime de traiter certains agrégats macroéconomiques comme des causes à part entière, même sans mécanisme micro détaillé.",
    "type": "likert",
    "loading": {
      "method_individualism": -1.0
    },
    "anchor": false,
    "context": "general",
    "options": [
      "strongly_disagree",
      "disagree",
      "neutral",
      "agree",
      "strongly_agree",
      "unsure",
      "depends"
    ],
    "tags": [
      "adaptive",
      "method_individualism"
    ]
  },
  {
    "id": "q005",
    "text": "Les institutions n’agissent qu’à travers les incitations et croyances des individus.",
    "type": "likert",
    "loading": {
      "method_individualism": 1.0
    },
    "anchor": false,
    "context": "general",
    "options": [
      "strongly_disagree",
      "disagree",
      "neutral",
      "agree",
      "strongly_agree",
      "unsure",
      "depends"
    ],
    "tags": [
      "adaptive",
      "method_individualism"
    ]
  },
  {
    "id": "q006",
    "text": "Le comportement d’un groupe peut avoir des propriétés économiques qui ne se déduisent pas utilement de ses membres pris isolément.",
    "type": "likert",
    "loading": {
      "method_individualism": -1.0
    },
    "anchor": false,
    "context": "general",
    "options": [
      "strongly_disagree",
      "disagree",
      "neutral",
      "agree",
      "strongly_agree",
      "unsure",
      "depends"
    ],
    "tags": [
      "adaptive",
      "method_individualism"
    ]
  },
  {
    "id": "q007",
    "text": "Les modèles économiques gagnent en crédibilité lorsqu’ils peuvent être ramenés à des choix individuels explicites.",
    "type": "likert",
    "loading": {
      "method_individualism": 1.0
    },
    "anchor": false,
    "context": "general",
    "options": [
      "strongly_disagree",
      "disagree",
      "neutral",
      "agree",
      "strongly_agree",
      "unsure",
      "depends"
    ],
    "tags": [
      "adaptive",
      "method_individualism"
    ]
  },
  {
    "id": "q008",
    "text": "L’histoire économique exige parfois des explications structurelles qui ne peuvent pas être ramenées proprement à l’agent individuel.",
    "type": "likert",
    "loading": {
      "method_individualism": -1.0
    },
    "anchor": false,
    "context": "general",
    "options": [
      "strongly_disagree",
      "disagree",
      "neutral",
      "agree",
      "strongly_agree",
      "unsure",
      "depends"
    ],
    "tags": [
      "adaptive",
      "method_individualism"
    ]
  },
  {
    "id": "q009",
    "text": "La valeur économique d’un bien dépend principalement de l’évaluation subjective qu’en font les personnes à la marge.",
    "type": "likert",
    "loading": {
      "subjective_value": 1.0
    },
    "anchor": true,
    "context": "general",
    "options": [
      "strongly_disagree",
      "disagree",
      "neutral",
      "agree",
      "strongly_agree",
      "unsure",
      "depends"
    ],
    "tags": [
      "anchor",
      "subjective_value"
    ]
  },
  {
    "id": "q010",
    "text": "Les coûts de production et les rapports de production donnent un fondement plus profond à la valeur que les préférences individuelles.",
    "type": "likert",
    "loading": {
      "subjective_value": -1.0
    },
    "anchor": true,
    "context": "general",
    "options": [
      "strongly_disagree",
      "disagree",
      "neutral",
      "agree",
      "strongly_agree",
      "unsure",
      "depends"
    ],
    "tags": [
      "anchor",
      "subjective_value"
    ]
  },
  {
    "id": "q011",
    "text": "Deux personnes peuvent attribuer des valeurs économiques radicalement différentes au même bien sans qu’une valeur objective permette de les départager.",
    "type": "likert",
    "loading": {
      "subjective_value": 1.0
    },
    "anchor": false,
    "context": "general",
    "options": [
      "strongly_disagree",
      "disagree",
      "neutral",
      "agree",
      "strongly_agree",
      "unsure",
      "depends"
    ],
    "tags": [
      "adaptive",
      "subjective_value"
    ]
  },
  {
    "id": "q012",
    "text": "Une théorie de la valeur centrée sur les préférences manque une partie essentielle des rapports de production.",
    "type": "likert",
    "loading": {
      "subjective_value": -1.0
    },
    "anchor": false,
    "context": "general",
    "options": [
      "strongly_disagree",
      "disagree",
      "neutral",
      "agree",
      "strongly_agree",
      "unsure",
      "depends"
    ],
    "tags": [
      "adaptive",
      "subjective_value"
    ]
  },
  {
    "id": "q013",
    "text": "Les prix relatifs s’expliquent d’abord par l’utilité marginale et la rareté.",
    "type": "likert",
    "loading": {
      "subjective_value": 1.0
    },
    "anchor": false,
    "context": "general",
    "options": [
      "strongly_disagree",
      "disagree",
      "neutral",
      "agree",
      "strongly_agree",
      "unsure",
      "depends"
    ],
    "tags": [
      "adaptive",
      "subjective_value"
    ]
  },
  {
    "id": "q014",
    "text": "La distribution du surplus et la structure productive sont plus fondamentales que l’utilité marginale pour comprendre les prix.",
    "type": "likert",
    "loading": {
      "subjective_value": -1.0
    },
    "anchor": false,
    "context": "general",
    "options": [
      "strongly_disagree",
      "disagree",
      "neutral",
      "agree",
      "strongly_agree",
      "unsure",
      "depends"
    ],
    "tags": [
      "adaptive",
      "subjective_value"
    ]
  },
  {
    "id": "q015",
    "text": "Les préférences des agents constituent un point de départ légitime pour analyser la demande.",
    "type": "likert",
    "loading": {
      "subjective_value": 1.0
    },
    "anchor": false,
    "context": "general",
    "options": [
      "strongly_disagree",
      "disagree",
      "neutral",
      "agree",
      "strongly_agree",
      "unsure",
      "depends"
    ],
    "tags": [
      "adaptive",
      "subjective_value"
    ]
  },
  {
    "id": "q016",
    "text": "La valeur ne peut pas être comprise correctement sans référence aux conditions sociales et techniques de production.",
    "type": "likert",
    "loading": {
      "subjective_value": -1.0
    },
    "anchor": false,
    "context": "general",
    "options": [
      "strongly_disagree",
      "disagree",
      "neutral",
      "agree",
      "strongly_agree",
      "unsure",
      "depends"
    ],
    "tags": [
      "adaptive",
      "subjective_value"
    ]
  },
  {
    "id": "q017",
    "text": "Une grande partie de l’information économique utile est locale et tacite, donc difficile à centraliser.",
    "type": "likert",
    "loading": {
      "knowledge_decentralization": 1.0,
      "institutions_causal": 0.25
    },
    "anchor": true,
    "context": "general",
    "options": [
      "strongly_disagree",
      "disagree",
      "neutral",
      "agree",
      "strongly_agree",
      "unsure",
      "depends"
    ],
    "tags": [
      "anchor",
      "knowledge_decentralization"
    ]
  },
  {
    "id": "q018",
    "text": "Avec de bonnes données et des capacités de calcul suffisantes, une autorité centrale peut agréger l’essentiel de l’information nécessaire à l’allocation.",
    "type": "likert",
    "loading": {
      "knowledge_decentralization": -1.0
    },
    "anchor": true,
    "context": "general",
    "options": [
      "strongly_disagree",
      "disagree",
      "neutral",
      "agree",
      "strongly_agree",
      "unsure",
      "depends"
    ],
    "tags": [
      "anchor",
      "knowledge_decentralization"
    ]
  },
  {
    "id": "q019",
    "text": "Les prix de marché jouent un rôle essentiel de communication d’informations dispersées.",
    "type": "likert",
    "loading": {
      "knowledge_decentralization": 1.0,
      "institutions_causal": 0.25
    },
    "anchor": false,
    "context": "general",
    "options": [
      "strongly_disagree",
      "disagree",
      "neutral",
      "agree",
      "strongly_agree",
      "unsure",
      "depends"
    ],
    "tags": [
      "adaptive",
      "knowledge_decentralization"
    ]
  },
  {
    "id": "q020",
    "text": "Les systèmes modernes de données réduisent fortement l’avantage informationnel de la coordination décentralisée.",
    "type": "likert",
    "loading": {